[
  {
    "id": "X-001",
    "category": "gap",
    "persona": "cro",
    "severity": "P0",
    "title": "Hiring/admissions disclaimer is opt-in only and absent from default reports",
    "claim": "The only 'do not use for hiring' warning in the report is inside the verbose_caveats branch; the default report and --scores-only/--json outputs carry no use restriction, while the tool is intended for screening people.",
    "evidence": [
      {
        "file": "mcp-server/tools/reporter.py",
        "line": 265,
        "excerpt": "    if verbose_caveats or format_flag == \"--verbose-caveats\":"
      },
      {
        "file": "mcp-server/tools/reporter.py",
        "line": 277,
        "excerpt": "\"    • Do not use these estimates for hiring, clinical, or legal decisions.\""
      }
    ],
    "impact_on_screened_person": "A recruiter receiving the default or slim score output sees an IQ number with no warning and may reject a candidate on it.",
    "fixability": "guardrail",
    "fix": "Make a prohibited/high-risk-use notice mandatory in every output format (including --scores-only and --json via a 'use_restriction' field) and require an explicit use_context acknowledgement; refuse or degrade when context is hiring/admission.",
    "acceptance_test": "test_reporter_default_and_slim_outputs_always_include_use_restriction",
    "phase": 4,
    "status": "open",
    "depends_on": []
  },
  {
    "id": "X-002",
    "category": "gap",
    "persona": "cro",
    "severity": "P0",
    "title": "No consent or lawful-basis capture for processing a person's text (UU PDP)",
    "claim": "Nothing in the server or pipeline records data-subject consent, lawful basis, or purpose before analysing a person's writing; UU PDP No. 27/2022 requires explicit consent/lawful basis and purpose limitation, and inferred IQ/education is sensitive profiling.",
    "evidence": [
      {
        "file": "mcp-server/server.py",
        "line": 0,
        "excerpt": "absence: no consent, subject_id, purpose or lawful_basis parameter on any tool_* function (e.g. tool_detect_language(text: str))"
      },
      {
        "file": "README.md",
        "line": 904,
        "excerpt": "**Privacy.** Text submitted to the MCP server is processed locally."
      }
    ],
    "impact_on_screened_person": "A person's writing is scored and profiled without their knowledge or ability to refuse, with no lawful basis on record.",
    "fixability": "process",
    "fix": "Add docs/compliance/consent-and-lawful-basis.md with consent text (ID/EN), purpose statement and lawful-basis matrix, and require a consent_ref + purpose argument that the pipeline refuses to run without.",
    "acceptance_test": "doc: docs/compliance/consent-and-lawful-basis.md exists and names UU PDP 27/2022 consent, purpose limitation and withdrawal procedure",
    "phase": 4,
    "status": "open",
    "depends_on": []
  },
  {
    "id": "X-003",
    "category": "gap",
    "persona": "cro",
    "severity": "P0",
    "title": "No audit trail of who scored whom, when, with which model/norm version",
    "claim": "Scoring is stateless: no record of request, operator, input hash, norm file version, code version or output is persisted, so a contested decision cannot be reconstructed or defended.",
    "evidence": [
      {
        "file": "scripts/pipeline.py",
        "line": 33,
        "excerpt": "    return {\n        \"lang\": lang,\n        \"vfs\": vfs[\"vfs\"],"
      },
      {
        "file": "mcp-server/server.py",
        "line": 0,
        "excerpt": "absence: no logging, audit record or request id anywhere in server.py"
      }
    ],
    "impact_on_screened_person": "A rejected applicant cannot obtain or contest the basis of the decision, and the operator cannot prove what was computed.",
    "fixability": "code",
    "fix": "Emit an append-only audit record (UTC timestamp, operator id, SHA-256 of input, tool versions, norms hash, outputs) for every pipeline run, stored without raw text.",
    "acceptance_test": "test_pipeline_run_appends_audit_record_with_input_hash_and_norms_version",
    "phase": 4,
    "status": "open",
    "depends_on": []
  },
  {
    "id": "X-004",
    "category": "gap",
    "persona": "cro",
    "severity": "P0",
    "title": "No human-in-the-loop gate or automated-decision safeguard",
    "claim": "Outputs are final numeric verdicts with a classification label; there is no review-required state, no override/appeal field and no block on fully automated use. UU PDP and the EU AI Act (Annex III employment/education) require human oversight and a right to contest automated decisions.",
    "evidence": [
      {
        "file": "mcp-server/tools/reporter.py",
        "line": 108,
        "excerpt": "    line(f\"  Classification  : {iq_result['classification']}\")"
      },
      {
        "file": "mcp-server/server.py",
        "line": 0,
        "excerpt": "absence: no human_review, reviewer or appeal parameter or state"
      }
    ],
    "impact_on_screened_person": "A low-band label such as 'Low' can drive an automated rejection with nobody accountable and no route to appeal.",
    "fixability": "guardrail",
    "fix": "Add a mandatory 'decision_status: advisory_only / requires_human_review' field to all outputs, a reviewer sign-off record, and refuse outputs shaped as pass/fail thresholds.",
    "acceptance_test": "test_report_marks_every_output_advisory_requires_human_review",
    "phase": 4,
    "status": "open",
    "depends_on": []
  },
  {
    "id": "X-005",
    "category": "gap",
    "persona": "cro",
    "severity": "P1",
    "title": "No adverse-impact (EEOC four-fifths) or subgroup fairness monitoring",
    "claim": "No code or doc computes selection-rate ratios or score gaps across protected groups (language, gender, region, ethnicity, age); the four-fifths rule and EU AI Act bias testing are unaddressed although norms are English-derived.",
    "evidence": [
      {
        "file": "tests/test_mapper.py",
        "line": 0,
        "excerpt": "absence: no subgroup or adverse-impact test; only per-function unit tests"
      },
      {
        "file": "mcp-server/tools/reporter.py",
        "line": 262,
        "excerpt": "line(\"    • IQ/VFS norms are English-derived and only approximately adapted to\")"
      }
    ],
    "impact_on_screened_person": "Indonesian-language and regional-dialect applicants are systematically scored lower and screened out at a disproportionate rate, undetected.",
    "fixability": "process",
    "fix": "Write docs/compliance/adverse-impact-protocol.md defining protected groups, selection-rate ratio and four-fifths check, and add scripts/adverse_impact.py that runs on a labelled cohort and fails below 0.8.",
    "acceptance_test": "doc: docs/compliance/adverse-impact-protocol.md exists and specifies four-fifths ratio computation and remediation threshold",
    "phase": 4,
    "status": "open",
    "depends_on": []
  },
  {
    "id": "X-006",
    "category": "gap",
    "persona": "cro",
    "severity": "P1",
    "title": "Education-level inference is protected-attribute-adjacent with no safeguard",
    "claim": "estimate_education_level infers formal schooling (S1/S2/S3) from text style and the report asserts 'Writing style consistent with X authorship', producing credentials-like claims about a person that may be wrong and discriminatory in admissions.",
    "evidence": [
      {
        "file": "mcp-server/tools/reporter.py",
        "line": 243,
        "excerpt": "line(f\"  Writing style consistent with {edu_result['level_en']} authorship.\")"
      },
      {
        "file": "mcp-server/config/edu_norms.json",
        "line": 0,
        "excerpt": "absence: no source, validation or citation for fog/ari/lexical-density thresholds"
      }
    ],
    "impact_on_screened_person": "Self-taught or non-native writers are labelled as lower-educated, creating a false credential record that can bar them.",
    "fixability": "guardrail",
    "fix": "Remove the education-level claim from default output or gate behind explicit non-screening use; add provenance metadata to edu_norms.json and a warning that it is not a credential.",
    "acceptance_test": "test_education_estimate_not_in_default_report_for_screening_context",
    "phase": 4,
    "status": "open",
    "depends_on": []
  },
  {
    "id": "X-007",
    "category": "gap",
    "persona": "cro",
    "severity": "P1",
    "title": "No data minimisation: reports quote the subject's own sentences verbatim",
    "claim": "The report embeds verbatim sentences (truncated at 100 chars) as evidence in every section, and the mental-age and age inputs are collected though not necessary for any screening decision; this violates data minimisation and spreads personal content into reports.",
    "evidence": [
      {
        "file": "mcp-server/tools/reporter.py",
        "line": 188,
        "excerpt": "        line(f\"    → {_trunc(ev['sentence'])}\")"
      },
      {
        "file": "mcp-server/server.py",
        "line": 103,
        "excerpt": "def tool_predict_mental_age(iq_estimate: float, chronological_age: int = 0) -> str:"
      }
    ],
    "impact_on_screened_person": "Sensitive personal statements and age (a protected attribute) are reproduced in documents that circulate to recruiters.",
    "fixability": "code",
    "fix": "Add a redact_evidence option defaulting on (sentence index plus triggers only) and make chronological_age opt-in with documented purpose.",
    "acceptance_test": "test_report_default_redacts_verbatim_sentences",
    "phase": 4,
    "status": "open",
    "depends_on": []
  },
  {
    "id": "X-008",
    "category": "gap",
    "persona": "cro",
    "severity": "P1",
    "title": "No retention, deletion or data-subject-rights process",
    "claim": "There is no retention schedule, deletion procedure or access/correction/objection process for scored text or reports; example/ outputs show reports are written to disk as plain Markdown.",